[{"distributor":"MCKESSON CORPORATION","year":2006,"pills":580000,"share_pct":38.92617449664429},{"distributor":"CARDINAL HEALTH","year":2006,"pills":380000,"share_pct":25.503355704697988},{"distributor":"AMERISOURCEBERGEN DRUG CORPORATION","year":2006,"pills":300000,"share_pct":20.13422818791946},{"distributor":"H.D. SMITH WHOLESALE DRUG CO","year":2006,"pills":150000,"share_pct":10.06711409395973},{"distributor":"MIAMI-LUKEN INC","year":2006,"pills":80000,"share_pct":5.369127516778524},{"distributor":"MCKESSON CORPORATION","year":2007,"pills":612000,"share_pct":38.490566037735846},{"distributor":"CARDINAL HEALTH","year":2007,"pills":410000,"share_pct":25.78616352201258},{"distributor":"AMERISOURCEBERGEN DRUG CORPORATION","year":2007,"pills":320000,"share_pct":20.12578616352201},{"distributor":"H.D. SMITH WHOLESALE DRUG CO","year":2007,"pills":162000,"share_pct":10.18867924528302},{"distributor":"MIAMI-LUKEN INC","year":2007,"pills":86000,"share_pct":5.408805031446541},{"distributor":"MCKESSON CORPORATION","year":2008,"pills":650000,"share_pct":38.190364277320796},{"distributor":"CARDINAL HEALTH","year":2008,"pills":442000,"share_pct":25.969447708578144},{"distributor":"AMERISOURCEBERGEN DRUG CORPORATION","year":2008,"pills":345000,"share_pct":20.27027027027027},{"distributor":"H.D. SMITH WHOLESALE DRUG CO","year":2008,"pills":173000,"share_pct":10.164512338425382},{"distributor":"MIAMI-LUKEN INC","year":2008,"pills":92000,"share_pct":5.405405405405405},{"distributor":"MCKESSON CORPORATION","year":2009,"pills":685000,"share_pct":37.803532008830025},{"distributor":"CARDINAL HEALTH","year":2009,"pills":472000,"share_pct":26.048565121412803},{"distributor":"AMERISOURCEBERGEN DRUG CORPORATION","year":2009,"pills":371000,"share_pct":20.474613686534216},{"distributor":"H.D. SMITH WHOLESALE DRUG CO","year":2009,"pills":185000,"share_pct":10.20971302428256},{"distributor":"MIAMI-LUKEN INC","year":2009,"pills":99000,"share_pct":5.4635761589403975},{"distributor":"MCKESSON CORPORATION","year":2010,"pills":715000,"share_pct":37.592008412197686},{"distributor":"CARDINAL HEALTH","year":2010,"pills":495000,"share_pct":26.025236593059937},{"distributor":"AMERISOURCEBERGEN DRUG CORPORATION","year":2010,"pills":392000,"share_pct":20.60988433228181},{"distributor":"H.D. SMITH WHOLESALE DRUG CO","year":2010,"pills":196000,"share_pct":10.304942166140904},{"distributor":"MIAMI-LUKEN INC","year":2010,"pills":104000,"share_pct":5.467928496319663},{"distributor":"MCKESSON CORPORATION","year":2011,"pills":735000,"share_pct":37.73100616016427},{"distributor":"CARDINAL HEALTH","year":2011,"pills":505000,"share_pct":25.924024640657084},{"distributor":"AMERISOURCEBERGEN DRUG CORPORATION","year":2011,"pills":402000,"share_pct":20.636550308008214},{"distributor":"H.D. SMITH WHOLESALE DRUG CO","year":2011,"pills":199000,"share_pct":10.215605749486652},{"distributor":"MIAMI-LUKEN INC","year":2011,"pills":107000,"share_pct":5.492813141683778},{"distributor":"MCKESSON CORPORATION","year":2012,"pills":750120,"share_pct":37.87847801354621},{"distributor":"CARDINAL HEALTH","year":2012,"pills":512400,"share_pct":25.87443626905172},{"distributor":"AMERISOURCEBERGEN DRUG CORPORATION","year":2012,"pills":408003,"share_pct":20.602747113742993},{"distributor":"H.D. SMITH WHOLESALE DRUG CO","year":2012,"pills":201050,"share_pct":10.152332966223357},{"distributor":"MIAMI-LUKEN INC","year":2012,"pills":108760,"share_pct":5.4920056374357245},{"distributor":"MCKESSON CORPORATION","year":2013,"pills":742000,"share_pct":36.3903874448259},{"distributor":"CARDINAL HEALTH","year":2013,"pills":545000,"share_pct":26.728788621873466},{"distributor":"AMERISOURCEBERGEN DRUG CORPORATION","year":2013,"pills":432000,"share_pct":21.186856302108875},{"distributor":"H.D. SMITH WHOLESALE DRUG CO","year":2013,"pills":208000,"share_pct":10.201078960274645},{"distributor":"MIAMI-LUKEN INC","year":2013,"pills":112000,"share_pct":5.492888670917116},{"distributor":"MCKESSON CORPORATION","year":2014,"pills":728000,"share_pct":35.0},{"distributor":"CARDINAL HEALTH","year":2014,"pills":572000,"share_pct":27.5},{"distributor":"AMERISOURCEBERGEN DRUG CORPORATION","year":2014,"pills":452000,"share_pct":21.73076923076923},{"distributor":"H.D. SMITH WHOLESALE DRUG CO","year":2014,"pills":214000,"share_pct":10.288461538461538},{"distributor":"MIAMI-LUKEN INC","year":2014,"pills":114000,"share_pct":5.480769230769231}]